{"id":"hyperx-pulsefire-dart-receiver","name":"HyperX Pulsefire Dart (receiver)","vendor":"HyperX","vid":"0x0951","pid":"0x16E1","productString":"HyperX Pulsefire Dart","manufacturerString":"HyperX","type":"mouse","connection":"usb","descriptor":"05010902a1010901a1000509190129051500250195057501810295038101050116018026ff7f093009317510950281061581257f0938750895018106c0c0","inputReportSize":null,"notes":"62-byte report descriptor of the mouse interface (interface 0) of a real HyperX Pulsefire Dart, read with usbhid-dump from the device: https://github.com/santeri3700/hyperx_pulsefire_dart_reverse_engineering/blob/22d298dbb8b71fc54f8c43c54336f589dbf97a93/misc/usb_hid_report_descriptors_0951_16e1_wireless.txt#L14-L17. The source gives the device's name, not its own USB strings, so productString is that name. Other interfaces of the real device are not part of this profile."}