{"id":"xbox-360-wired-ffb","name":"Xbox 360 Controller (Wired, FFB experiment)","vendor":"Microsoft","vid":"0x045E","pid":"0x028E","productString":"Controller (XBOX 360 For Windows)","manufacturerString":"\u00a9Microsoft Corporation","type":"gamepad","connection":"usb","descriptor":"05010905a1018501a10009300931150026ffff350046ffff950275108102c0a10009330934150026ffff350046ffff950275108102c0a1000932150026ffff350046ffff950175108102c0a10009400941150026ffff350046ffff950275108102c005091901290a950a7501810205010939150125083500463b10660e00750495018142750295018103750895028103c0050f0901a101850f09210921150026ff00750895079102c0","inputReportSize":19,"deviceDescription":"Controller (XBOX 360 For Windows) [FFB experiment]","triggerMode":"combined","notes":"EXPERIMENTAL variant of xbox-360-wired with a second TLC (Usage Page PID, Usage Set Effect Report) containing a Report ID 0x0F 7-byte output. Tests whether WGI's hidforcefeedback.cpp path dispatches vibration to an explicit HID PID output collection even on a 045E VID that xinputhid doesn't bind to. Consumers may see this as two separate gamepad entities — mitigate by checking browser + joy.cpl view. If input parsing breaks, revert to xbox-360-wired."}
