{"id":"ps3-remote","name":"PlayStation 3 Blu-ray Remote","vendor":"Sony","vid":"0x054C","pid":"0x0306","productString":"BD Remote Control","manufacturerString":"Sony","type":"other","connection":"bluetooth","descriptor":"05010905a101a102750895018101050919012918142501750195188102c0a10205091829fe1426fe00750895018075089506810105060920142505750895018102c0c0","inputReportSize":null,"notes":"67-byte descriptor. Source: Linux kernel hid-sony.c ps3remote_rdesc.","layout":{"kind":"remote","source":"https://en.wikipedia.org/wiki/PlayStation_3_accessories#Blu-ray_Disc_remotes","buttons":[]}}
