{"id":"corsair-strafe-rgb","name":"Corsair STRAFE RGB","vendor":"Corsair","vid":"0x1B1C","pid":"0x1B20","productString":"Corsair STRAFE RGB Gaming Keyboard","manufacturerString":"Corsair","type":"keyboard","connection":"usb","versionNumber":776,"descriptor":"05010906a1018501050719e029e71500250175019508810219002997150025017501959881020508190129032501750195039102750595019101c0050c0901a1018502050c19002aff0f150026ff0f751095028100c006c0ff0902a1018503150026ff00953f750809028102c006c2ff0903a101850e150026ff00953f750809038102c0","inputReportSize":null,"notes":"132-byte report descriptor of the keyboard interface (interface 0) of a real Corsair STRAFE RGB, read with usbhid-dump from the device: https://github.com/hrvach/deskhop/issues/45#issuecomment-1914672897. Other interfaces of the real device are not part of this profile."}