{"id":"logitech-mx518","name":"Logitech MX518","vendor":"Logitech","vid":"0x046D","pid":"0xC08E","productString":"MX518 Gaming Mouse","manufacturerString":"Logitech","type":"mouse","connection":"usb","versionNumber":16384,"descriptor":"05010902a1010901a10005091901291015002501951075018102050116018026ff7f751095020930093181061581257f7508950109388106050c0a380295018106c0c0","inputReportSize":null,"notes":"67-byte report descriptor of the mouse interface (interface 0) of a real Logitech MX518, rebuilt from an lsusb or TMK descriptor listing of the device, at the length the listing states: https://gist.github.com/2407fdaa73deb35082154c3ba81c84ef/66a3a74f3098fca267cafb18ad1d75dee7065d5c#file-gistfile1-txt. Other interfaces of the real device are not part of this profile."}