{"id":"sidewinder-force-feedback-2","name":"SideWinder Force Feedback 2 Joystick","vendor":"Microsoft","vid":"0x045E","pid":"0x001B","productString":"SideWinder Force Feedback 2 Joystick","manufacturerString":"Microsoft","deviceDescription":"SideWinder Force Feedback 2 Joystick","type":"joystick","connection":"usb","descriptor":"05010904a1010901a100850109301600fe26ff01350046ff03750a9501810275069501810309311600fe26ff01750a95018102750695018103093515e0251f3500453f6514750695018102750295018103c0050f0992a1028502099f09a009a409a509a6150025017501950545006500810275039501810309941500250175019501810209221501252835014528750795018102c00921a10285110922150125287508950191020925a102092609270930093109320933093409400941094209430928150c250075089501350045009100c0095009540951150026ff7f350046ff7f57fdffffff6603107510950391020952150026ff00350046102755006500750895019102095315012508350145087508950191020955a1020501093009311500250175019502350045009102c0050f0956150025017501950191027505950191030957a102050a09010902150026ff00350047a08c000057feffffff750895029102c0050f09a7150026ff7f350046ff7f57fdffffff660310751095019102c0095aa10285120922150125283501452855006500750895019102095b095d150026ff003500461027750895029102095c095e150026ff7f350046ff7f57fdffffff660310751095029102c0095fa10285130922150125283501452855006500750895019102092315002501350045017504950191020958a102050a0901090215002501750295029102c0050f0960096109621580257f36f0d8461027750895039102096309640965150026ff003500461027750895039102c0096ea1028514092215012528350145287508950191020970150026ff003500461027750895019102096f1580257f36f0d84610277508950191020971150026ff00350047a08c000057feffffff65147508950191020972150026ff7f350046ff7f57fdffffff660310751095019102c00973a1028515092215012528350145285500650075089501910209701601ff26ff0036f0d8461027751095019102c00974a102851609221501252835014528750895019102097509761580257f36f0d8461027750895029102c00968a102851709221501252835014528750895019102096c1500261027350046102775109501910209691581257f350046ff007508950c920201c00966a10285180501093009311581257f750895029102c0050f0977a102851a092215012528350145287508950191020978a1020979097a097b1503250075089501350045009100c0097c150026ff00350046ff00750895019102c00990a102851b09221501252835014528750895019102c00996a102851c099709980999099a099b099c1506250075089501350045009100c0097da102851d097e150026ff003500461027750895019102c0096ba102851e09221501252835014528750895019102096d150026ff00350046ff007508950191020951150026ff7f350046ff7f57fdffffff660310751095019102c009aba1020925a1028511092609270930093109320933093409400941094209430928150c250075089501450055006500b100c00501093b150026ff01350046ff01750a9501b10275069501b103c08501050109361500257f3500457f7507950181027501950181030939150025073500463b0165147504950181427504950181030509190129081500250175019508450065008102c0","inputReportSize":null,"nativeDescriptor":"05010904a1010901a100850109301600fe26ff01350046ff03750a9501810275069501810309311600fe26ff01750a95018102750695018103093515e0251f3500453f6514750695018102750295018103c0050f0992a1028502099f09a009a409a509a6150025017501950545006500810275039501810309941500250175019501810209221501252835014528750795018102c00921a10285010922150125287508950191020925a102092609270930093109320933093409400941094209430928150c250075089501350045009100c0095009540951150026ff7f350046ff7f57fdffffff6603107510950391020952150026ff00350046102755006500750895019102095315012508350145087508950191020955a1020501093009311500250175019502350045009102c0050f0956150025017501950191027505950191030957a102050a09010902150026ff00350047a08c000057feffffff750895029102c0050f09a7150026ff7f350046ff7f57fdffffff660310751095019102c0095aa10285020922150125283501452855006500750895019102095b095d150026ff003500461027750895029102095c095e150026ff7f350046ff7f57fdffffff660310751095029102c0095fa10285030922150125283501452855006500750895019102092315002501350045017504950191020958a102050a0901090215002501750295029102c0050f0960096109621580257f36f0d8461027750895039102096309640965150026ff003500461027750895039102c0096ea1028504092215012528350145287508950191020970150026ff003500461027750895019102096f1580257f36f0d84610277508950191020971150026ff00350047a08c000057feffffff65147508950191020972150026ff7f350046ff7f57fdffffff660310751095019102c00973a1028505092215012528350145285500650075089501910209701601ff26ff0036f0d8461027751095019102c00974a102850609221501252835014528750895019102097509761580257f36f0d8461027750895029102c00968a102850709221501252835014528750895019102096c1500261027350046102775109501910209691581257f350046ff007508950c920201c00966a10285080501093009311581257f750895029102c0050f0977a102850a092215012528350145287508950191020978a1020979097a097b1503250075089501350045009100c0097c150026ff00350046ff00750895019102c00990a102850b09221501252835014528750895019102c00996a102850c099709980999099a099b099c1506250075089501350045009100c0097da102850d097e150026ff003500461027750895019102c0096ba102850e09221501252835014528750895019102096d150026ff00350046ff007508950191020951150026ff7f350046ff7f57fdffffff660310751095019102c009aba1020925a1028501092609270930093109320933093409400941094209430928150c250075089501450055006500b100c00501093b150026ff01350046ff01750a9501b10275069501b103c0050f0989a10285020922150125283501452875089501b102098ba102098c098d098e150325007508950135004500b100c009ac17ffff0000250075109501b100c0097fa10285030980150027ffff0000350047ffff000075109501b1020983150026ff00350046ff0075089501b10209a909aa15002501750195024500b10275069501b103c08501050109361500257f3500457f7507950181027501950181030939150025073500463b0165147504950181427504950181030509190129081500250175019508450065008102c0","notes":"1221-byte shipping descriptor; original 1355-byte capture preserved verbatim in nativeDescriptor. Source: HMDeviceExtractor (HIDAPI preparsed-data reconstruction). The native capture declared three Feature reports (Create New Effect 0x01, PID Block Load 0x02, PID Pool 0x03) which AVs DirectInput's pid.dll CreateEffect path; pid.dll only supports a single Feature report (Create New Effect) per the canonical PID FFB descriptor shape. Shipping descriptor strips the Block Load and Pool Feature collections; the SDK responds to dinput's GetFeature(BlockLoad)/GetFeature(Pool) at canonical RIDs (0x12/0x13) via shared-memory state, identical to AddPidFfbBlock-built profiles. v1.3.12 also renumbers all FFB Report IDs (Set Effect / Set Envelope / Set Constant Force / Effect Operation / Block Free / Device Control / etc. on Output, plus Create New Effect on Feature) from the SideWinder firmware's non-canonical 0x01-0x0E to canonical 0x11-0x1E so HMController.OutputReceived consumers (PadForge etc.) decode the wire bytes uniformly with AddPidFfbBlock-built profiles, AND so PidReportIdExtractor's Output-Set-Effect-fallback heuristic (which the SideWinder triggers because it uses Usage 0xAB rather than canonical 0x88 for Create New Effect) lands on the correct RID for SetFeature dispatch. The shipping descriptor's PID FFB layout is now structurally identical to canonical for all Feature/Output report IDs. Classic Microsoft FFB flight stick: X/Y stick, twist (rudder), throttle slider, 8-way hat, 8 buttons. Force feedback via DirectInput PID FFB.","layout":{"kind":"joystick","source":"https://en.wikipedia.org/wiki/Microsoft_SideWinder#Force_Feedback_2","stick":{"side":"left","xAxis":"X","yAxis":"Y"},"rudder":{"axis":"Rz","kind":"twist"},"throttle":{"axis":"Slider","role":"throttle"},"hats":[{"axis":"Hat","positions":8,"location":"stick_top"}],"trigger":{"buttonIndex":0,"stages":1},"stickButtons":[{"role":"thumb","buttonIndex":1},{"role":"unknown","buttonIndex":2},{"role":"unknown","buttonIndex":3}],"baseButtons":[{"role":"unknown","buttonIndex":4},{"role":"unknown","buttonIndex":5},{"role":"unknown","buttonIndex":6},{"role":"unknown","buttonIndex":7}],"forceFeedback":true}}
