{
  "id": "ch-throttle-quadrant",
  "name": "CH Products Throttle Quadrant",
  "vendor": "CH Products",
  "vid": "0x068E",
  "pid": "0x00FA",
  "productString": "Ch Throttle Quadrant",
  "manufacturerString": "CH Products, Inc.",
  "type": "other",
  "connection": "usb",
  "descriptor": null,
  "inputReportSize": null,
  "notes": "VID/PID confirmed from Linux USB database / kernel sources / SDL. Descriptor requires physical hardware capture."
}
