{"id":"logitech-unifying-receiver-mouse","name":"Logitech Unifying Receiver (mouse)","vendor":"Logitech","vid":"0x046D","pid":"0xC52B","productString":"Unifying Receiver","manufacturerString":"Logitech","type":"mouse","connection":"usb","versionNumber":9232,"descriptor":"05010902a10185020901a1000509190129101500250195107501810205011601f826ff07750c95020930093181061581257f7508950109388106050c0a380295018106c0c0050c0901a101850375109502150126ff0219012aff028100c005010980a10185047502950115012503098209810983816075068103c006bcff0988a1018508190129ff150126ff00750895018100c0","inputReportSize":null,"notes":"148-byte report descriptor of the mouse interface (interface 1) of a real Logitech Unifying Receiver, read with usbhid-dump from the device: https://github.com/libusb/hidapi/issues/531#issuecomment-1509578704. The source gives the device's name, not its own USB strings, so productString is that name. Other interfaces of the real device are not part of this profile."}