{"id":"p5general-activtor","name":"P5 General (PS5-compatible Activtor)","vendor":"Activtor","vid":"0x2B81","pid":"0x0101","productString":"P5General","manufacturerString":"Activtor","type":"gamepad","connection":"usb","descriptor":"05010905a1018501093009310932093509330934150026ff007508950681020600ff09209501810205010939150025073500463b016514750495018142650005091901290e150025017501950e81020600ff0921950e81020600ff0922150026ff0075089534810285020923952f910285030a2128952fb1020680ff85e009579502b102c006f0ff0940a10185f00947953fb10285f10948953fb10285f20949950fb102c0","inputReportSize":null,"notes":"165-byte PS5-compatible descriptor. Source: GP2040-CE P5GeneralDescriptors.h. DualSense-like with auth feature reports.","layout":{"kind":"unspecified","note":"P5General Activator (2B81:0101) — VID is unassigned-public, product not in any authoritative catalog. Authoring deferred."}}
