{"id":"dell-ms116","name":"Dell MS116","vendor":"Dell","vid":"0x413C","pid":"0x301A","productString":"Dell optical mouse MS116t1","manufacturerString":"Dell","type":"mouse","connection":"usb","descriptor":"05010902a1010901a100050919012903150025017501950381027505950181030600ff0940950275081581257f8102050109381581257f7508950181060930093116018026ff7f751095028106c0c0","inputReportSize":null,"notes":"79-byte report descriptor of the mouse interface (interface 0) of a real Dell MS116, from the usb-hid-device-report-corpus dump of the device: https://github.com/steve-chamberlin/usb-hid-device-report-corpus/blob/37179eb6d8c61847c27a6def827a9dce39bf608d/mice/413C-301A Dell optical mouse MS116t1.txt#L70-L74. The source gives the device's name, not its own USB strings, so productString is that name. Other interfaces of the real device are not part of this profile."}