{"id":"hhkb-professional","name":"HHKB Professional (Topre)","vendor":"PFU","vid":"0x0853","pid":"0x0100","productString":"HHKB Professional","manufacturerString":"Topre Corporation","type":"keyboard","connection":"usb","versionNumber":258,"descriptor":"05010906a101050719e029e71500250175019508810295017508810195057501050819012905910295017503910195067508150026ff00050719002aff008100c0","inputReportSize":null,"notes":"65-byte report descriptor of the keyboard interface (interface 0) of a real HHKB Professional, rebuilt from an lsusb or TMK descriptor listing of the device, at the length the listing states: https://gist.github.com/e9d5b0b514e9d0c353344d7d4424e653/17cbf1f785c1244029381e826f62c5adda96d432#file-gistfile1-txt. Other interfaces of the real device are not part of this profile."}