{"id":"xbox-series-xs","name":"Xbox Series X|S Controller (Model 1914)","vendor":"Microsoft","vid":"0x045E","pid":"0x0B12","driverPid":"0x02FF","productString":"Controller","manufacturerString":"Microsoft","type":"gamepad","connection":"usb","descriptor":"05010905a101a10009300931150027ffff0000950275108102c0a10009330934150027ffff0000950275108102c005010932150026ff039501750a81021500250075069501810305010935150026ff039501750a81021500250075069501810305091901290c950c750181021500250075049501810305010939150125083500463b0166140075049501814275049501150025003500450065008103a102050f0997150025017504950191021500250091030970150025647508950491020950660110550e26ff009501910209a7910265005500097c9102c005010980a10009851500250195017501810215002500750795018103c005060920150026ff00750895018102c0","nativeDescriptor":"05010905a101a10009300931150027ffff0000950275108102c0a10009330934150027ffff0000950275108102c005010932150026ff039501750a81021500250075069501810305010935150026ff039501750a81021500250075069501810305091901290a950a750181021500250075069501810305010939150125083500463b0166140075049501814275049501150025003500450065008103a102050f0997150025017504950191021500250091030970150025647508950491020950660110550e26ff009501910209a7910265005500097c9102c005010980a10009851500250195017501810215002500750795018103c005060920150026ff00750895018102c0","inputReportSize":null,"notes":"262-byte XboxGIP descriptor (USB/Windows view), extended from 10 to 12 buttons so the Share button lands at descriptor button 12 (padding 6b→4b, 16-bit envelope unchanged). nativeDescriptor preserves the original 10-button GIP. Newer Model 1797 uses USB PID 0x0B05, BLE PID 0x0B22.","deviceDescription":"Xbox Controller","triggerMode":"separate","driverMode":"xinputhid","buttonMap":[0,1,2,3,4,5,6,7,8,9,-1,-1,11],"layout":{"kind":"gamepad","source":"https://en.wikipedia.org/wiki/Xbox_Wireless_Controller#Third_revision_(2020)","sticks":[{"side":"left","xAxis":"X","yAxis":"Y","clickButton":8},{"side":"right","xAxis":"Rx","yAxis":"Ry","clickButton":9}],"triggers":[{"axis":"Z","side":"left","kind":"analog"},{"axis":"Rz","side":"right","kind":"analog"}],"dpad":{"encoding":"hat","hatAxis":"Hat","hatPositions":8},"faceButtons":[{"role":"face_a","buttonIndex":0},{"role":"face_b","buttonIndex":1},{"role":"face_x","buttonIndex":2},{"role":"face_y","buttonIndex":3}],"shoulderButtons":[{"role":"left_bumper","buttonIndex":4},{"role":"right_bumper","buttonIndex":5}],"systemButtons":[{"role":"view","buttonIndex":6},{"role":"menu","buttonIndex":7}],"haptics":{"rumble":"impulse_triggers","triggerHaptics":true},"extraButtons":[{"role":"share","buttonIndex":11}]}}
