{
  "id": "fanatec-podium-dd2",
  "name": "Fanatec Podium DD2",
  "vendor": "Fanatec",
  "vid": "0x0EB7",
  "pid": "0x0007",
  "productString": "Podium Wheel Base DD2",
  "manufacturerString": "Endor AG",
  "type": "wheel",
  "connection": "usb",
  "descriptor": null,
  "inputReportSize": null,
  "notes": "Requires physical hardware dump."
}
