{
  "id": "vkbsim-gunfighter-sce-l",
  "name": "VKBsim Gunfighter Mk.III SCE (L)",
  "vendor": "VKBSim",
  "vid": "0x231D",
  "pid": "0x0127",
  "productString": "Gunfighter Mk.III 'Space Combat Edition' (L)",
  "manufacturerString": "VKB-Sim",
  "type": "joystick",
  "connection": "usb",
  "descriptor": null,
  "inputReportSize": null,
  "notes": "VID/PID confirmed from Linux USB database / kernel sources / SDL. Descriptor requires physical hardware capture."
}
