{"id":"joypad-gc-adapter","name":"Joypad-OS GameCube Adapter (HID)","vendor":"Nintendo","vid":"0x057E","pid":"0x0337","productString":"WUP-028","manufacturerString":"Nintendo Co., Ltd.","type":"gamepad","connection":"usb","descriptor":"05010905a101a103851119002aff00150026ff00750895059100c0a10385210600ff0901150026ff00750895248102c0a103851319002aff00150026ff00750895019100c0c0","inputReportSize":null,"notes":"joypad-os's emulation of the Wii U GameCube adapter, not Nintendo's own device: the 70-byte report descriptor joypad-os serves (joypad-ai/joypad-os src/usb/usbd/descriptors/gc_adapter_descriptors.h). It declares a Game Pad application with report 0x11, five output bytes after its ID, report 0x21, 36 input bytes after its ID, and report 0x13, one output byte after its ID. The strings are the ones joypad-os serves, Nintendo Co., Ltd. and WUP-028. Nintendo's adapter declares a different 214-byte descriptor, which gamecube-adapter-hid carries, and gamecube-adapter is the working persona.","layout":{"kind":"unspecified","note":"joypad-os's emulation of the WUP-028 adapter. nintendo/gamecube-adapter-hid carries Nintendo's own descriptor."}}