{
  "id": "ch-combatstick",
  "name": "CH Products Combatstick",
  "vendor": "CH Products",
  "vid": "0x068E",
  "pid": "0x00F4",
  "productString": "Combatstick",
  "manufacturerString": "CH Products, Inc.",
  "type": "joystick",
  "connection": "usb",
  "descriptor": null,
  "inputReportSize": null,
  "notes": "VID/PID confirmed from Linux USB database / kernel sources / SDL. Descriptor requires physical hardware capture."
}
